Review ID,Product Name,Rating,Review Content,Timestamp,Customer Email,Product Category,Order Value,Fulfillment Status,Shipping Country
1911,Ceramic Coffee Mug,5,Exactly what I needed - perfect fit!,2025-04-06 04:30:59,davidmiller@example.net,Home,109.01,fulfilled,Bangladesh
1912,Wireless Earbuds,5,The instructions were clear and setup was easy.,2025-03-11 09:22:01,andrea44@example.com,Electronics,150.85,returned,Marshall Islands
1913,Throw Pillow,2,Underwhelming performance overall.,2025-05-29 16:14:44,castroapril@example.net,Home,19.97,fulfilled,Philippines
1914,Hair Dryer,5,Exceptional quality. Couldn't be happier!,2025-02-18 23:44:33,thomascarol@example.com,Beauty,37.11,returned,Vietnam
1915,Black Jeans,5,The perfect gift - recipient loved it!,2025-06-20 00:18:49,jonathan43@example.net,Apparel,57.42,returned,Paraguay
1916,Smart Watch,4,Does the job but could be more user-friendly.,2025-02-18 22:58:39,andrew41@example.org,Electronics,128.47,refunded,Turkey
1917,Yoga Mat,4,Would buy again but hope for small improvements.,2024-10-18 15:22:37,zacharywerner@example.com,Home,133.43,fulfilled,Dominica
1918,Fitness Tracker,1,Literally caught fire during normal use.,2025-05-21 03:02:56,william96@example.org,Electronics,38.01,fulfilled,Madagascar
1919,Classic White T-Shirt,3,Okay for beginners but professionals will want more.,2024-08-15 11:19:51,changlatasha@example.org,Apparel,138.73,fulfilled,British Indian Ocean Territory (Chagos Archipelago)
1920,Wireless Earbuds,4,Functional but the interface could be more intuitive.,2024-10-04 14:58:02,ybanks@example.org,Electronics,90.08,returned,French Southern Territories
1921,Ceramic Coffee Mug,5,I've tried many brands and this is the best by far.,2025-05-31 06:30:02,millerbryan@example.org,Home,21.37,fulfilled,El Salvador
1922,Desk Lamp,5,Worth the wait - absolutely perfect!,2025-01-12 19:11:40,ryanmark@example.net,Home,102.2,refunded,Russian Federation
1923,Fitness Tracker,4,Good for beginners but pros might want more features.,2025-01-12 21:32:57,hvasquez@example.org,Electronics,76.0,fulfilled,Korea
1924,Ceramic Coffee Mug,4,Good for everyday use but not heavy-duty.,2025-03-10 14:15:13,thomasrobyn@example.com,Home,116.69,returned,Monaco
1925,Hoodie,2,Lasted less time than expected.,2025-01-24 12:02:14,adamsjames@example.com,Apparel,87.4,fulfilled,Afghanistan
1926,Acne Face Wash,5,Arrived carefully packaged with no damage.,2025-06-03 04:15:44,samantha07@example.net,Beauty,51.76,refunded,Equatorial Guinea
1927,Yoga Mat,4,I'm happy with my purchase but it's not flawless.,2024-08-25 01:14:38,lpeters@example.net,Home,36.57,refunded,Guinea
1928,Summer Dress,5,Arrived early and in perfect condition.,2025-06-26 17:25:56,christopher22@example.net,Apparel,38.96,fulfilled,Argentina
1929,Sunscreen SPF 50,4,Comfortable but could use better padding.,2025-01-02 19:03:56,brenda12@example.org,Beauty,106.64,refunded,Egypt
1930,Desk Lamp,3,Not offensive but not appealing either.,2025-03-04 00:32:20,lortega@example.net,Home,173.69,refunded,Gabon
1931,Desk Lamp,4,Works as advertised with minor quirks.,2024-10-25 03:09:36,tjacobs@example.com,Home,187.56,refunded,Mauritius
1932,Yoga Mat,5,I'm so glad I chose this over competitors.,2024-08-01 23:55:46,melanie31@example.com,Home,14.13,returned,Guyana
1933,Ceramic Coffee Mug,3,Fair product at a fair price.,2024-12-24 13:30:21,james47@example.org,Home,91.9,returned,Ireland
1934,Hair Dryer,2,Malfunctioned almost immediately.,2025-01-09 18:53:54,johnroberts@example.org,Beauty,137.92,returned,Cape Verde
1935,Throw Pillow,4,Good but not worth the full retail price.,2024-11-21 15:24:25,whitesusan@example.com,Home,74.91,fulfilled,Guernsey
1936,Ceramic Coffee Mug,3,Functional but unremarkable.,2024-07-25 17:16:10,thomasparker@example.com,Home,66.82,fulfilled,Falkland Islands (Malvinas)
1937,Fitness Tracker,5,I'm blown away by how good this is!,2024-11-05 20:44:11,amy48@example.net,Electronics,169.37,fulfilled,Denmark
1938,Lipstick Set,5,My kids love it too - family approved!,2024-12-24 07:02:33,cobbjeremy@example.org,Beauty,120.87,fulfilled,Chile
1939,Summer Dress,5,Absolutely love this product! Exceeded my expectations.,2025-03-09 04:42:07,john66@example.net,Apparel,109.47,refunded,Bahrain
1940,Lipstick Set,5,The attention to detail is remarkable.,2024-08-25 11:13:30,lanebecky@example.net,Beauty,75.66,fulfilled,Panama
1941,Classic White T-Shirt,5,I use this every day and it still looks new.,2024-09-21 19:55:36,travishaynes@example.net,Apparel,100.7,refunded,Sudan
1942,Ceramic Coffee Mug,4,Satisfactory with room for improvement.,2024-11-28 01:04:44,emily86@example.com,Home,179.15,fulfilled,Palestinian Territory
1943,Fitness Tracker,2,Instructions were unclear or missing.,2024-12-09 00:03:09,james57@example.net,Electronics,56.39,returned,Poland
1944,Classic White T-Shirt,4,Pleasant experience with minor drawbacks.,2025-04-30 10:58:11,caldwelldiane@example.com,Apparel,62.39,returned,Slovenia
1945,Hair Dryer,2,Not worth the money in my opinion.,2025-01-30 02:50:39,anolan@example.org,Beauty,63.89,returned,Serbia
1946,Summer Dress,4,Does what it promises with minor drawbacks.,2024-12-21 17:57:36,mossjoseph@example.com,Apparel,154.36,fulfilled,United States Virgin Islands
1947,Lipstick Set,5,The instructions were clear and setup was easy.,2025-03-01 02:08:12,barronpatrick@example.org,Beauty,18.98,returned,Singapore
1948,Wireless Earbuds,5,Simple to use and works flawlessly.,2025-01-06 22:33:21,marcus56@example.com,Electronics,197.38,fulfilled,Palestinian Territory
1949,Yoga Mat,5,The quality rivals products twice the price.,2025-04-01 06:26:59,jose95@example.com,Home,183.26,fulfilled,Pakistan
1950,Summer Dress,3,Not worth returning but won't repurchase.,2024-08-31 21:20:37,gjohnson@example.net,Apparel,23.16,fulfilled,Puerto Rico
1951,Bluetooth Speaker,2,Requires constant adjustments to work.,2025-02-17 21:07:39,fmcpherson@example.net,Electronics,114.45,returned,Australia
1952,Sunscreen SPF 50,5,Perfect in every way - will definitely buy again!,2024-12-30 14:24:39,aaronwall@example.org,Beauty,179.79,returned,Saint Vincent and the Grenadines
1953,Hoodie,4,Effective but the instructions could be clearer.,2025-07-02 07:44:20,banksaustin@example.com,Apparel,136.34,returned,Mali
1954,Summer Dress,3,Wouldn't recommend but wouldn't warn against.,2025-01-09 20:26:27,katherine63@example.com,Apparel,160.14,fulfilled,New Caledonia
1955,Sunscreen SPF 50,5,Great for beginners and experts alike.,2025-06-08 03:08:22,dawnvasquez@example.org,Beauty,181.54,refunded,Sweden
1956,Hair Dryer,5,I can't imagine my life without this now!,2024-12-04 06:45:44,popekyle@example.com,Beauty,34.18,refunded,Iran
1957,Yoga Mat,4,Took longer to arrive than expected but good quality.,2024-12-07 21:38:20,ykeller@example.com,Home,101.53,fulfilled,Kenya
1958,Black Jeans,5,I'm blown away by how good this is!,2024-12-25 14:26:25,xjackson@example.org,Apparel,164.95,fulfilled,Myanmar
1959,Sunscreen SPF 50,4,Good for beginners but pros might want more features.,2024-07-21 19:34:57,ellisclaire@example.com,Beauty,41.73,fulfilled,Holy See (Vatican City State)
1960,Acne Face Wash,5,The quality rivals products twice the price.,2024-10-09 12:39:06,obrennan@example.com,Beauty,97.92,fulfilled,Switzerland
1961,Hair Dryer,3,Fairly standard - no surprises good or bad.,2024-10-27 20:52:32,ryan60@example.org,Beauty,14.49,fulfilled,Bhutan
1962,Hair Dryer,5,Worth every penny. The quality is outstanding.,2024-11-29 07:58:46,brittanyweaver@example.com,Beauty,66.54,refunded,Benin
1963,Wireless Earbuds,5,The attention to detail is remarkable.,2024-11-02 10:43:57,hsloan@example.org,Electronics,35.24,fulfilled,Russian Federation
1964,Acne Face Wash,3,Meh. It exists and functions.,2025-06-06 08:09:45,sellersdavid@example.com,Beauty,132.81,returned,Swaziland
1965,Smart Watch,2,Disappointed with the quality.,2025-01-29 02:00:09,doughertyjessica@example.com,Electronics,170.31,fulfilled,Liberia
1966,Lipstick Set,5,Arrived carefully packaged with no damage.,2024-08-25 07:53:24,gellis@example.com,Beauty,86.69,fulfilled,New Caledonia
1967,Lipstick Set,5,Arrived early and in perfect condition.,2024-08-15 02:07:57,jonessarah@example.net,Beauty,79.35,fulfilled,Zimbabwe
1968,Fitness Tracker,5,Beautiful craftsmanship and durable materials.,2024-09-02 09:40:03,audreysmith@example.net,Electronics,56.51,fulfilled,Iran
1969,Sunscreen SPF 50,4,Good quality but could be more durable.,2025-05-22 13:34:21,sarahpayne@example.net,Beauty,112.64,fulfilled,Poland
1970,Smart Watch,3,Not worth returning but won't repurchase.,2025-01-18 04:43:24,georgemichelle@example.com,Electronics,118.56,returned,Belize
1971,Wireless Earbuds,3,"It's okay. Not great, not terrible.",2025-02-25 07:03:37,donna73@example.com,Electronics,35.97,returned,Ecuador
1972,Sunscreen SPF 50,2,Overpriced for what you get.,2024-10-23 01:45:37,kristy23@example.com,Beauty,24.77,fulfilled,Christmas Island
1973,Acne Face Wash,5,The perfect addition to my collection.,2025-07-05 16:59:09,winterselizabeth@example.com,Beauty,180.33,fulfilled,India
1974,Yoga Mat,5,The colors are even more vibrant in person.,2024-08-18 20:47:20,ashley62@example.com,Home,159.05,fulfilled,Zambia
1975,Hoodie,4,Looks great but shows fingerprints easily.,2024-09-17 20:55:59,ngarner@example.com,Apparel,167.46,refunded,Finland
1976,Smart Watch,5,The quality rivals products twice the price.,2025-03-17 21:02:50,huangjeffrey@example.net,Electronics,126.44,fulfilled,Brazil
1977,Desk Lamp,3,Perfectly average in every way.,2025-05-05 15:52:07,mccormickstephanie@example.com,Home,13.82,fulfilled,Canada
1978,Acne Face Wash,5,Customer service was excellent when I had questions.,2024-11-27 08:39:42,stoutronald@example.net,Beauty,38.01,fulfilled,Argentina
1979,Classic White T-Shirt,5,My kids love it too - family approved!,2025-03-24 01:26:20,vargaserica@example.net,Apparel,196.74,fulfilled,Australia
1980,Hoodie,3,Gets the job done but not elegantly.,2025-01-27 16:18:32,jenniferallen@example.com,Apparel,25.35,returned,Korea
1981,Lipstick Set,5,My new favorite product. Works perfectly!,2024-09-02 20:06:39,nwatson@example.org,Beauty,175.6,fulfilled,Dominica
1982,Bluetooth Speaker,5,Exactly what I needed - perfect fit!,2025-07-19 11:51:09,christina66@example.net,Electronics,27.98,fulfilled,Micronesia
1983,Hoodie,3,Average product - does the job but nothing special.,2025-07-02 03:51:49,susancross@example.org,Apparel,141.06,fulfilled,Israel
1984,Hoodie,5,Perfect in every way - will definitely buy again!,2024-10-18 12:26:36,blairjeffery@example.net,Apparel,122.66,returned,Malaysia
1985,Desk Lamp,4,Comfortable but could use better padding.,2024-10-01 05:25:50,wheelerchristina@example.com,Home,87.25,fulfilled,Hong Kong
1986,Desk Lamp,4,Nice quality but the color fades after washing.,2025-04-16 03:02:04,parker61@example.org,Home,172.83,fulfilled,Montenegro
1987,Summer Dress,4,Great product overall with room for small improvements.,2025-05-28 15:11:03,wanda14@example.net,Apparel,90.61,fulfilled,San Marino
1988,Fitness Tracker,5,I'm so impressed I bought a second one!,2025-04-21 23:03:34,chadpaul@example.com,Electronics,152.03,refunded,Lithuania
1989,Yoga Mat,5,Great for beginners and experts alike.,2024-11-15 03:16:24,toddclark@example.com,Home,196.52,fulfilled,Congo
1990,Black Jeans,5,The perfect balance of form and function.,2025-03-04 23:28:10,aprilbolton@example.com,Apparel,129.28,returned,Mauritius
1991,Classic White T-Shirt,3,Decent but the competition does it better.,2024-10-15 02:19:24,smithemily@example.com,Apparel,28.79,refunded,Philippines
1992,Summer Dress,4,Nice quality but the color fades after washing.,2025-05-07 07:57:01,heatherhuff@example.net,Apparel,70.46,fulfilled,Switzerland
1993,Acne Face Wash,5,I can't imagine my life without this now!,2025-03-09 17:55:32,christensenerica@example.net,Beauty,55.03,fulfilled,Egypt
1994,Ceramic Coffee Mug,4,Good value for money with some limitations.,2025-02-23 13:44:36,juliesmith@example.net,Home,41.54,returned,Niger
1995,Desk Lamp,4,Comfortable fit but runs slightly large.,2024-12-28 10:01:17,spencerrebecca@example.com,Home,73.67,fulfilled,Zimbabwe
1996,Sunscreen SPF 50,3,Satisfactory but leaves room for improvement.,2025-01-23 16:51:06,daniel49@example.net,Beauty,176.12,refunded,Svalbard & Jan Mayen Islands
1997,Desk Lamp,3,Fair product at a fair price.,2025-07-14 15:43:19,georgelee@example.org,Home,91.86,returned,Western Sahara
1998,Classic White T-Shirt,3,Perfectly average in every way.,2025-01-08 06:12:34,aparsons@example.com,Apparel,38.69,fulfilled,American Samoa
1999,Fitness Tracker,4,The color is slightly different than pictured.,2025-01-13 14:23:19,tammymichael@example.com,Electronics,61.58,fulfilled,Greece
2000,Desk Lamp,2,Poor packaging led to damage.,2025-05-02 10:18:36,kimberlybarrera@example.com,Home,147.42,fulfilled,Colombia
2001,Lipstick Set,4,Powerful but a bit noisy during operation.,2024-07-23 20:52:48,johnestes@example.org,Beauty,175.38,refunded,Pakistan
2002,Hoodie,3,Fair product at a fair price.,2024-09-28 09:53:15,angelarosales@example.org,Apparel,64.27,returned,United States Virgin Islands
2003,Black Jeans,5,I've tried many brands and this is the best by far.,2024-11-23 13:26:24,emilycurry@example.com,Apparel,197.05,returned,Saint Barthelemy
2004,Lipstick Set,4,Better than average but not exceptional.,2024-08-21 05:47:02,jonesjustin@example.net,Beauty,12.35,fulfilled,Saint Vincent and the Grenadines
2005,Lipstick Set,4,Works as intended but not exceptional.,2024-07-23 15:09:02,deborahfranco@example.net,Beauty,137.69,fulfilled,Serbia
2006,Wireless Earbuds,5,Great for beginners and experts alike.,2025-03-14 03:05:40,nstrickland@example.org,Electronics,79.96,returned,Burundi
2007,Bluetooth Speaker,3,Functional but unremarkable.,2024-09-19 20:55:36,johndaugherty@example.org,Electronics,58.81,returned,United Kingdom
2008,Fitness Tracker,4,The color is slightly different than pictured.,2025-01-06 16:08:18,amymueller@example.net,Electronics,67.34,returned,Malta
2009,Desk Lamp,4,Works well but took some time to set up properly.,2024-07-24 13:16:12,vegaalan@example.org,Home,10.2,fulfilled,Djibouti
2010,Acne Face Wash,5,Simple to use and works flawlessly.,2025-02-22 01:14:40,pbrandt@example.org,Beauty,171.65,refunded,Isle of Man
2011,Ceramic Coffee Mug,5,This product changed my daily routine for the better.,2025-06-11 18:32:59,cynthia82@example.net,Home,150.92,fulfilled,Bhutan
2012,Sunscreen SPF 50,5,Worth every penny. The quality is outstanding.,2024-11-01 05:17:37,xalexander@example.net,Beauty,169.82,fulfilled,Belarus
2013,Sunscreen SPF 50,3,Just okay - nothing to write home about.,2025-05-25 21:50:00,hli@example.net,Beauty,145.38,fulfilled,Cocos (Keeling) Islands
2014,Lipstick Set,5,I've recommended this to all my friends!,2024-08-13 11:05:45,jenniferblack@example.org,Beauty,96.38,returned,Antarctica (the territory South of 60 deg S)
2015,Wireless Earbuds,2,Disappointed with the quality.,2025-02-25 08:06:16,dwilliams@example.com,Electronics,53.48,fulfilled,Hungary
2016,Throw Pillow,4,Good for everyday use but not heavy-duty.,2024-08-31 13:38:10,jesse13@example.org,Home,25.52,fulfilled,Eritrea
2017,Summer Dress,3,Doesn't excel in any particular area.,2024-07-27 15:23:14,usimon@example.net,Apparel,61.3,returned,Tonga
2018,Sunscreen SPF 50,4,I'm happy with my purchase but it's not flawless.,2025-06-23 20:51:08,nmorrow@example.net,Beauty,142.29,returned,Kenya
2019,Throw Pillow,4,Effective but the instructions could be clearer.,2024-08-12 10:00:38,rossjones@example.net,Home,189.28,refunded,Puerto Rico
2020,Lipstick Set,5,Solved a problem I've had for years.,2025-06-04 11:10:32,fgordon@example.com,Beauty,110.44,refunded,Antigua and Barbuda
2021,Yoga Mat,3,Neither impressed nor disappointed.,2025-07-16 15:14:38,hunternicole@example.com,Home,19.9,refunded,British Indian Ocean Territory (Chagos Archipelago)
2022,Hair Dryer,3,Meh. It exists and functions.,2025-05-10 02:24:52,susan67@example.com,Beauty,49.59,fulfilled,Hong Kong
2023,Sunscreen SPF 50,5,The photos don't do it justice - it's even better in person.,2024-08-06 11:29:28,garciaabigail@example.org,Beauty,59.71,refunded,Ethiopia
2024,Smart Watch,5,Absolutely love this product! Exceeded my expectations.,2025-01-05 11:49:41,crystalyoung@example.net,Electronics,41.66,refunded,Montserrat
2025,Smart Watch,5,Customer service was excellent when I had questions.,2025-05-05 10:31:33,andrew50@example.org,Electronics,154.52,fulfilled,Estonia
2026,Throw Pillow,2,Poor packaging led to damage.,2024-10-03 00:00:08,riosjennifer@example.org,Home,132.96,fulfilled,Lebanon
2027,Wireless Earbuds,3,Wouldn't recommend but wouldn't warn against.,2025-03-14 04:22:04,ryancurry@example.org,Electronics,73.46,fulfilled,Portugal
2028,Desk Lamp,5,The company stands behind their product 100%.,2025-03-27 01:25:28,cdoyle@example.com,Home,104.56,refunded,Hungary
2029,Wireless Earbuds,4,Met most of my expectations.,2025-01-29 15:13:30,nguyenpamela@example.org,Electronics,141.85,fulfilled,Comoros
2030,Black Jeans,3,Acceptable but won't buy again.,2024-08-18 20:52:13,benjamin34@example.net,Apparel,156.29,refunded,Palau
2031,Lipstick Set,3,Adequate quality for occasional use.,2025-02-05 02:48:28,gmartin@example.com,Beauty,63.57,returned,Romania
2032,Hair Dryer,5,Simple to use and works flawlessly.,2025-02-02 12:18:31,regina58@example.com,Beauty,95.74,returned,Gibraltar
2033,Black Jeans,5,Better than I imagined. Fast shipping too!,2025-04-22 17:15:56,brian55@example.org,Apparel,115.7,fulfilled,Cuba
2034,Hoodie,2,Not worth the money in my opinion.,2025-04-30 07:31:38,jaredhenry@example.com,Apparel,177.48,fulfilled,Equatorial Guinea
2035,Summer Dress,3,Not offensive but not appealing either.,2025-04-14 14:15:59,newmanjoseph@example.net,Apparel,25.96,refunded,Czech Republic
2036,Acne Face Wash,2,Not suitable for intended purpose.,2024-10-26 06:04:22,bergjonathon@example.net,Beauty,69.87,returned,United States of America
2037,Smart Watch,5,The perfect gift - recipient loved it!,2024-12-17 08:50:52,tasha39@example.com,Electronics,156.26,fulfilled,Croatia
2038,Desk Lamp,4,Good for beginners but pros might want more features.,2024-07-24 21:00:18,frank04@example.org,Home,131.29,fulfilled,Sri Lanka
2039,Yoga Mat,5,I'm so glad I chose this over competitors.,2025-04-19 04:29:50,john38@example.net,Home,78.97,fulfilled,Korea
2040,Bluetooth Speaker,3,Fairly standard - no surprises good or bad.,2025-01-07 11:21:47,imartinez@example.com,Electronics,125.24,fulfilled,Malaysia
2041,Lipstick Set,4,Does what it promises with minor drawbacks.,2024-10-02 17:50:02,alexamoore@example.org,Beauty,71.86,refunded,Malaysia
2042,Acne Face Wash,4,Met most of my expectations.,2025-06-15 06:36:28,alicia07@example.org,Beauty,71.35,returned,Libyan Arab Jamahiriya
2043,Acne Face Wash,5,I'm so glad I chose this over competitors.,2025-01-23 01:19:26,jamesguerra@example.org,Beauty,48.32,refunded,Latvia
2044,Lipstick Set,3,Perfectly average in every way.,2025-03-22 21:23:38,uflores@example.org,Beauty,50.25,returned,Antigua and Barbuda
2045,Fitness Tracker,5,Packaging was eco-friendly and product arrived safely.,2024-07-20 09:33:24,aaronhamilton@example.com,Electronics,34.92,refunded,Latvia
2046,Wireless Earbuds,5,Arrived early and in perfect condition.,2025-06-24 13:18:03,zpatrick@example.net,Electronics,12.15,fulfilled,French Southern Territories
2047,Fitness Tracker,4,Nice quality but the color fades after washing.,2025-05-02 10:41:01,wolfealex@example.com,Electronics,193.37,fulfilled,Maldives
2048,Yoga Mat,2,Quality control issues apparent.,2024-09-22 20:05:08,hooperterri@example.net,Home,105.0,returned,Kenya
2049,Wireless Earbuds,1,Item was clearly used/returned before.,2024-08-13 03:24:19,holly33@example.org,Electronics,99.66,refunded,Libyan Arab Jamahiriya
2050,Summer Dress,5,Arrived carefully packaged with no damage.,2024-09-03 11:31:35,stephaniekline@example.com,Apparel,171.78,returned,Puerto Rico
2051,Hair Dryer,3,Neither impressed nor disappointed.,2025-03-10 15:55:25,ericareese@example.org,Beauty,56.64,fulfilled,Croatia
2052,Summer Dress,4,Took longer to arrive than expected but good quality.,2024-12-04 14:02:23,keithandrews@example.net,Apparel,153.71,returned,Korea
2053,Desk Lamp,3,Perfectly average in every way.,2025-04-26 14:50:48,watsonheather@example.com,Home,52.34,returned,Grenada
2054,Summer Dress,5,I was skeptical but this delivered beyond expectations.,2025-06-12 08:14:50,athompson@example.com,Apparel,99.3,fulfilled,Puerto Rico
2055,Yoga Mat,5,The perfect balance of form and function.,2025-05-18 01:23:49,suzannegallagher@example.org,Home,114.74,fulfilled,Saudi Arabia
2056,Hoodie,1,Expired product sold as new.,2025-02-24 13:36:31,stacyalvarado@example.com,Apparel,160.01,refunded,French Guiana
2057,Yoga Mat,2,Not worth the money in my opinion.,2025-04-04 10:49:02,wvelasquez@example.org,Home,119.62,fulfilled,Puerto Rico
2058,Hoodie,2,Flimsy materials - won't last long.,2024-09-29 14:30:45,adamsmith@example.com,Apparel,139.6,fulfilled,United States of America
2059,Lipstick Set,5,Simple to use and works flawlessly.,2025-06-10 03:03:50,pcox@example.org,Beauty,84.3,refunded,United States of America
2060,Ceramic Coffee Mug,5,I've recommended this to all my friends!,2025-07-17 15:41:11,barbara78@example.net,Home,187.56,fulfilled,Congo
2061,Hoodie,5,The perfect addition to my collection.,2025-02-02 11:51:15,thomashaley@example.com,Apparel,98.18,returned,Montserrat
2062,Hair Dryer,5,Perfect size and weight - very comfortable.,2024-10-27 23:54:12,nhubbard@example.org,Beauty,66.23,fulfilled,Chad
2063,Sunscreen SPF 50,2,Difficult to use as intended.,2025-05-24 10:43:55,sarah86@example.net,Beauty,185.0,fulfilled,Andorra
2064,Smart Watch,5,I can't imagine my life without this now!,2025-03-27 14:50:20,hrush@example.com,Electronics,66.56,fulfilled,Belize
2065,Smart Watch,5,Great for beginners and experts alike.,2025-03-19 19:32:34,kevinproctor@example.com,Electronics,158.22,returned,Pakistan
2066,Bluetooth Speaker,4,Does what it promises with minor drawbacks.,2025-05-22 19:28:45,qmoses@example.org,Electronics,116.04,refunded,Malawi
2067,Fitness Tracker,5,Five stars isn't enough - it's that good!,2025-05-10 00:38:49,wanda03@example.org,Electronics,116.29,returned,Mauritania
2068,Sunscreen SPF 50,5,100% satisfied. Met all my requirements.,2025-05-31 18:30:03,sshah@example.net,Beauty,16.71,returned,Netherlands
2069,Acne Face Wash,4,Good for everyday use but not heavy-duty.,2025-02-03 01:34:55,rodriguezedward@example.net,Beauty,154.01,refunded,El Salvador
2070,Sunscreen SPF 50,3,Fair product at a fair price.,2025-04-01 16:38:50,owallace@example.org,Beauty,60.4,fulfilled,Macao
2071,Yoga Mat,5,I use this every day and it still looks new.,2024-09-17 20:20:40,catherine65@example.net,Home,120.87,refunded,Falkland Islands (Malvinas)
2072,Throw Pillow,5,100% satisfied. Met all my requirements.,2024-09-03 04:14:15,mitchellcynthia@example.com,Home,134.85,fulfilled,United States Virgin Islands
2073,Desk Lamp,3,Middle of the road - neither good nor bad.,2024-07-30 04:26:12,drew01@example.com,Home,71.79,fulfilled,Papua New Guinea
2074,Bluetooth Speaker,5,The colors are even more vibrant in person.,2024-09-09 07:44:36,kerri81@example.org,Electronics,80.0,refunded,Turkey
2075,Smart Watch,3,Doesn't excel in any particular area.,2025-04-06 10:09:49,noah04@example.net,Electronics,22.16,fulfilled,Malta
2076,Acne Face Wash,3,Exactly what you'd expect for the price.,2024-11-03 02:32:53,edwardtaylor@example.org,Beauty,92.97,fulfilled,Angola
2077,Summer Dress,5,Worth every penny. The quality is outstanding.,2025-01-18 17:54:20,chorne@example.net,Apparel,188.25,returned,Portugal
2078,Fitness Tracker,4,Functional but the interface could be more intuitive.,2024-11-03 22:36:05,tbentley@example.com,Electronics,33.61,fulfilled,British Virgin Islands
2079,Acne Face Wash,4,Great product overall with room for small improvements.,2024-08-27 00:07:57,robertsantos@example.org,Beauty,135.26,fulfilled,Algeria
2080,Lipstick Set,3,Wouldn't recommend but wouldn't warn against.,2025-07-08 02:42:44,oprice@example.net,Beauty,19.11,returned,Nepal
2081,Acne Face Wash,5,I've recommended this to all my friends!,2025-04-04 13:21:47,shawmichael@example.net,Beauty,62.31,refunded,Armenia
2082,Yoga Mat,4,Effective but could use more size options.,2024-10-10 21:23:01,bethanymontgomery@example.org,Home,169.71,fulfilled,Myanmar
2083,Wireless Earbuds,5,The instructions were clear and setup was easy.,2025-04-08 20:25:08,cassiemcpherson@example.net,Electronics,129.37,returned,Thailand
2084,Desk Lamp,4,Works well but took some time to set up properly.,2025-02-21 09:09:21,lynnjones@example.org,Home,188.08,fulfilled,Oman
2085,Bluetooth Speaker,5,The gold standard of products in this category.,2024-10-20 12:43:48,amy20@example.org,Electronics,123.23,fulfilled,Micronesia
2086,Desk Lamp,5,The perfect addition to my collection.,2024-08-13 09:15:19,carlos34@example.net,Home,198.36,fulfilled,Guyana
2087,Desk Lamp,5,The gold standard of products in this category.,2025-05-14 20:56:26,rosalesmatthew@example.org,Home,35.61,refunded,Trinidad and Tobago
2088,Acne Face Wash,5,The perfect gift - recipient loved it!,2024-11-19 14:12:48,dawnblackburn@example.org,Beauty,63.64,refunded,Iran
2089,Acne Face Wash,4,Looks great but shows fingerprints easily.,2025-01-10 19:41:00,ashley64@example.net,Beauty,46.12,returned,San Marino
2090,Hoodie,4,I'm happy with my purchase but it's not flawless.,2024-08-31 23:33:04,angelawhite@example.com,Apparel,16.54,refunded,Montenegro
2091,Sunscreen SPF 50,2,Not what I expected based on description.,2024-07-20 09:54:07,sancheztiffany@example.org,Beauty,40.09,fulfilled,Romania
2092,Ceramic Coffee Mug,4,Does what it promises with minor drawbacks.,2024-07-25 19:01:37,angela53@example.net,Home,46.06,returned,Belize
2093,Fitness Tracker,5,Beautiful craftsmanship and durable materials.,2024-08-23 05:30:27,evasquez@example.org,Electronics,54.31,fulfilled,Serbia
